match,team,market,line,over_price,under_price,agency
Sydney Thunder v Sydney Sixers,Sydney Thunder,First Over Runs - Team,6.5,1.97,1.74,BetRight
Sydney Thunder v Sydney Sixers,Sydney Sixers,First Over Runs - Team,6.5,2.03,1.69,BetRight
Melbourne Renegades v Hobart Hurricanes,Melbourne Renegades,First Over Runs - Team,6.5,1.97,1.74,BetRight
Adelaide Strikers v Melbourne Stars,Adelaide Strikers,First Over Runs - Team,7.5,1.85,1.85,BetRight
Adelaide Strikers v Melbourne Stars,Melbourne Stars,First Over Runs - Team,6.5,1.97,1.74,BetRight
